Judul ,Tahun,Nama Penulis ,Abstrak,Keywords
"PENGEMBANGAN E-COMMERCE PRODUK SUSU
BERBASIS WEB DI PETERNAKAN AL-BAQOROH
MENGGUNAKAN METODE INCREMENTAL",2019,MUHAMMAD ARIF WIDIYATMIKO,"To help increase income, the milk produced needs to be sold at a higher price
than the selling price to cooperatives and selling processed products such as yogurt
and cheese. Sales will be carried out using online outlets, which are lower than the
offline outlets. This study aims to create an information system as a tool for selling
milk and dairy products, and promoting al-baqarah farms. The method used in the
research is the method of incremental development. The first increment was
developed by nine features related to the product. the second increment was
developed nine features related to transactions. While the third increment was
developed six features related to features and transaction settlement. The dairy
product marketing information system is tested using the black box method which
has one to three cases for each functional requirement. The development of the
system was successfully built with an object oriented programming paradigm and
used the MariaDB database. The result of the third increment test results in the
suitability of the expected output from the testing scenario.",Milk; Milk Product; Marketing; E-commerce; Web Application
"ANALISIS FINANSIAL DAN NILAI TAMBAH
USAHA AGROFORESTRI KOPI PADA PROGRAM CSR
PT INDONESIA POWER UP MRICA KABUPATEN BANJARNEGARA",2019,FARADIS ALFI ZAIN,"Vegetable cultivation on the upstream area can be the main factor of
sediment source contribution in Panglima Besar Sudirman reservoir. Planting of
coffee through Sekolah Lapang Konservasi program aims to be the one of all
alternative in problem-solving. This research aims to determine the financial
feasibility of variety agroforestry scheme coffee business, examine the rate of
decreasing and increasing input price for business profit sensitivity and the
amount of added value from the coffee processed form in Leksana Village,
Karangkobar Sub-Regency, Banjarnegara Regency. Based on calculation of
financial analysis which used Discounted Cash Flow method, business with
crystal guava, sengon, Arabica coffee agroforestry scheme provide more profit
than sengon, Robusta coffee agroforestry scheme, and sengon, Robusta coffee
fences agroforestry scheme, the amount of NPV is Rp 1.315.264.047/ha, BCR is
2.41 and IRR is 113 %. Agroforestry of coffee business in Leksana Village more
sensitive for decreasing sale price than increasing production price. According to
the calculation of added value using the Hayami method, the coffee processed for
the roasted bean level provide the greatest added value, Rp 94.361/kg for Arabica
coffee and Rp 54.734/kg for Robusta coffee","added value, agroforestry, coffee, financial analysis"